{
  "source_id": "eventide",
  "carrier": "EVENTIDE",
  "url": "${MOCKSOURCES_URL}/eventide/rates",
  "format": "json",
  "auth": {"type": "api_key", "header": "X-Api-Key", "secret_env": "EVENTIDE_API_KEY"},
  "records_path": "data",
  "columns": {
    "origin_raw": "origin", "destination_raw": "destination",
    "container_type_raw": "type", "price_raw": "rate",
    "currency": "currency", "unit": "per_container",
    "valid_from_raw": "valid_from", "valid_to_raw": "valid_to"
  },
  "hints": {"decimal_style": "plain", "date_layout": "2006-01-02"},
  "timeout": "20s",
  "retry": {"max_attempts": 4, "base_backoff": "250ms", "max_backoff": "5s"},
  "rate_limit_rps": 10
}
